ID	Language_ID	Parameter_ID	Form	Value	Segments
mnc-185_iron-1	mnc	185_iron	sɤlɤ	sele	s ɤ l ɤ
mnc-161_perch-1	mnc	161_perch	kʰijakʰʊ	kiyakū	kʰ i j a kʰ ʊ
mnc-472_november-1	mnc	472_november	ɔmʃɔn pija	omšon biya	ɔ m ʃ ɔ n + p i j a
mnc-964_stir-1	mnc	964_stir	kʰʊrtampi	kūrdambi	kʰ ʊ r t a m p i
mnc-768_swim-1	mnc	768_swim	ʃɤtʰumpi	šetumbi	ʃ ɤ tʰ u m p i
mnc-261_line-2	mnc	261_line	sid͡ʒin	sijin	s i dʒ i n
mnc-752_move-2	mnc	752_move	aʃʃampi	aššambi	a ʃ ʃ a m p i
mnc-146_mouse-1	mnc	146_mouse	siŋkɤri	singgeri	s i ŋ k ɤ r i
mnc-911_instruct-2	mnc	911_instruct	tʰat͡ʃixijampi	tacihiyambi	tʰ a tʃ i x i j a m p i
mnc-53_odour-1	mnc	53_odour	amtʰan	amtan	a m tʰ a n
mnc-614_back-1	mnc	614_back	t͡ʃasxʊn	cashūn	tʃ a s x ʊ n
mnc-658_six-1	mnc	658_six	niŋkun	ninggun	n i ŋ k u n
mnc-652_howmuch-2	mnc	652_howmuch	ja kɤsɤ	ya gese	j a + k ɤ s ɤ
mnc-196_boy-2	mnc	196_boy	xaxa d͡ʒui	haha jui	x a x a + dʒ u i
mnc-986_request-2	mnc	986_request	aŋkalampi	anggalambi	a ŋ k a l a m p i
mnc-110_grass-1	mnc	110_grass	ɔrxɔ	orho	ɔ r x ɔ
mnc-875_pull-2	mnc	875_pull	kɔt͡ʃimpi	gocimbi	k ɔ tʃ i m p i
mnc-763_run-1	mnc	763_run	surtʰɤmpi	surtembi	s u r tʰ ɤ m p i
mnc-818_succeed-1	mnc	818_succeed	kusxɤmpi	gushembi	k u s x ɤ m p i
mnc-532_cheap-1	mnc	532_cheap	d͡ʒa	ja	dʒ a
mnc-189_glass-1	mnc	189_glass	pɔli	boli	p ɔ l i
mnc-20_back-2	mnc	20_back	sɤirɤ	seire	s ɤ i r ɤ
mnc-877_throw-1	mnc	877_throw	tʰulɤmpi	tulembi	tʰ u l ɤ m p i
mnc-450_day-2	mnc	450_day	inɤŋki	inenggi	i n ɤ ŋ k i
mnc-764_jump-2	mnc	764_jump	fɤkʰt͡ʃɤmpi	fekcembi	f ɤ kʰ tʃ ɤ m p i
mnc-864_spread-1	mnc	864_spread	id͡ʒumpi	ijumbi	i dʒ u m p i
mnc-886_receive-2	mnc	886_receive	parkijampi	bargiyambi	p a r k i j a m p i
mnc-732_tremble-2	mnc	732_tremble	tɤŋsitʰɤmpi	dengsitembi	t ɤ ŋ s i tʰ ɤ m p i
mnc-839_alter-3	mnc	839_alter	xalampi	halambi	x a l a m p i
mnc-803_hear-1	mnc	803_hear	tɔnd͡ʒimpi	donjimbi	t ɔ n dʒ i m p i
mnc-839_alter-2	mnc	839_alter	kʊwalijampi	gūwaliyambi	k ʊ w a l i j a m p i
mnc-602_sometimes-3	mnc	602_sometimes	ɤmɤmu ɤrintɤ	ememu erinde	ɤ m ɤ m u + ɤ r i n t ɤ
mnc-574_near-2	mnc	574_near	xant͡ʃikʰi	hanciki	x a n tʃ i kʰ i
mnc-598_afterwards-1	mnc	598_afterwards	amari	amari	a m a r i
mnc-545_lazy-1	mnc	545_lazy	panuxʊn	banuhūn	p a n u x ʊ n
mnc-937_shove-2	mnc	937_shove	t͡ʃuŋʊʃampi	cungūšambi	tʃ u ŋ ʊ ʃ a m p i
mnc-527_yellow-1	mnc	527_yellow	suwajan	suwayan	s u w a j a n
mnc-33_toe-1	mnc	33_toe	simxun	simhun	s i m x u n
mnc-418_boss-1	mnc	418_boss	ud͡ʒu	uju	u dʒ u
mnc-916_invite-1	mnc	916_invite	sɔlimpi	solimbi	s ɔ l i m p i
mnc-842_bend-1	mnc	842_bend	pukʰtampi	bukdambi	p u kʰ t a m p i
mnc-673_ahundred-1	mnc	673_ahundred	t͡ʃɤn	cen	tʃ ɤ n
mnc-171_berry-3	mnc	171_berry	d͡ʒand͡ʒuri	janjuri	dʒ a n dʒ u r i
mnc-980_decorate-2	mnc	980_decorate	mijamimpi	miyamimbi	m i j a m i m p i
mnc-67_dust-1	mnc	67_dust	purakʰi	buraki	p u r a kʰ i
mnc-978_getdressed-1	mnc	978_getdressed	ɤtʰukʰulɤmpi	etukulembi	ɤ tʰ u kʰ u l ɤ m p i
mnc-848_seize-1	mnc	848_seize	d͡ʒafampi	jafambi	dʒ a f a m p i
mnc-616_down-3	mnc	616_down	lilt͡ʃi	lilci	l i l tʃ i
mnc-467_june-1	mnc	467_june	niŋkun pija	ninggun biya	n i ŋ k u n + p i j a
mnc-500_heavy-2	mnc	500_heavy	lɤtʰɤ latʰa	lete lata	l ɤ tʰ ɤ + l a tʰ a
mnc-836_build-1	mnc	836_build	saxamɤ wɤilɤmpi	sahame weilembi	s a x a m ɤ + w ɤ i l ɤ m p i
mnc-929_defend-3	mnc	929_defend	sɤrɤmʃɤmpi	seremšembi	s ɤ r ɤ m ʃ ɤ m p i
mnc-439_bow-1	mnc	439_bow	pɤri	beri	p ɤ r i
mnc-812_do-1	mnc	812_do	arampi	arambi	a r a m p i
mnc-947_gather-2	mnc	947_gather	kanampi	ganambi	k a n a m p i
mnc-193_man-1	mnc	193_man	xaxa	haha	x a x a
mnc-434_border-1	mnc	434_border	kʊsixija	gūsihiya	k ʊ s i x i j a
mnc-903_praise-1	mnc	903_praise	t͡ʃakʰsimpi	caksimbi	tʃ a kʰ s i m p i
mnc-256_piece-3	mnc	256_piece	talkan	dalgan	t a l k a n
mnc-193_man-2	mnc	193_man	ɤikɤn	eigen	ɤ i k ɤ n
mnc-543_evil-3	mnc	543_evil	miɔsixɔn	miosihon	m i ɔ s i x ɔ n
mnc-32_nail-1	mnc	32_nail	xitʰaxʊn	hitahūn	x i tʰ a x ʊ n
mnc-781_comeback-2	mnc	781_comeback	pɤtɤrɤmpi	bederembi	p ɤ t ɤ r ɤ m p i
mnc-608_hence-1	mnc	608_hence	upat͡ʃi	ubaci	u p a tʃ i
mnc-961_boil-3	mnc	961_boil	puta arampi	buda arambi	p u t a + a r a m p i
mnc-275_tip-2	mnc	275_tip	pɔŋkɔ	bonggo	p ɔ ŋ k ɔ
mnc-758_step-1	mnc	758_step	fɤxʊn	fehūn	f ɤ x ʊ n
mnc-534_precious-2	mnc	534_precious	xixan	hihan	x i x a n
mnc-398_medicine-1	mnc	398_medicine	taifu i tɔrɔ	daifu i doro	t a i f u + i + t ɔ r ɔ
mnc-535_blind-2	mnc	535_blind	xid͡ʒuxʊn	hijuhūn	x i dʒ u x ʊ n
mnc-580_second-1	mnc	580_second	d͡ʒat͡ʃin	jacin	dʒ a tʃ i n
mnc-864_spread-2	mnc	864_spread	sɤkʰtʰɤmpi	sektembi	s ɤ kʰ tʰ ɤ m p i
mnc-174_onion-1	mnc	174_onion	ɤlu	elu	ɤ l u
mnc-576_left-1	mnc	576_left	xasxʊ	hashū	x a s x ʊ
mnc-697_burn-1	mnc	697_burn	tampi	dambi	t a m p i
mnc-998_understand-1	mnc	998_understand	sampi	sambi	s a m p i
mnc-601_once-2	mnc	601_once	ɤmu mari	emu mari	ɤ m u + m a r i
mnc-769_dive-1	mnc	769_dive	furimpi	furimbi	f u r i m p i
mnc-830_pickup-1	mnc	830_pickup	ud͡ʒimpi	ujimbi	u dʒ i m p i
mnc-698_smoke-3	mnc	698_smoke	akʰijapumpi	akiyabumbi	a kʰ i j a p u m p i
mnc-433_power-1	mnc	433_power	ɤrtɤmu	erdemu	ɤ r t ɤ m u
mnc-24_breast-1	mnc	24_breast	xuxun	huhun	x u x u n
mnc-541_slim-1	mnc	541_slim	kʰaŋkili	kanggili	kʰ a ŋ k i l i
mnc-323_broom-1	mnc	323_broom	ɤrikʰu	eriku	ɤ r i kʰ u
mnc-628_again-1	mnc	628_again	taxʊn	dahūn	t a x ʊ n
mnc-40_skin-2	mnc	40_skin	nɔtʰxɔ	notho	n ɔ tʰ x ɔ
mnc-976_takeoff-1	mnc	976_takeoff	kaimpi	gaimbi	k a i m p i
mnc-445_misfortune-1	mnc	445_misfortune	kɔsixɔn	gosihon	k ɔ s i x ɔ n
mnc-44_bone-2	mnc	44_bone	kiraŋki	giranggi	k i r a ŋ k i
mnc-701_thaw-1	mnc	701_thaw	wɤrumpi	werumbi	w ɤ r u m p i
mnc-623_very-3	mnc	623_very	tɤr tar sɤmɤ	der dar seme	t ɤ r + t a r + s ɤ m ɤ
mnc-311_table-1	mnc	311_table	tɤrɤ	dere	t ɤ r ɤ
mnc-317_window-1	mnc	317_window	fa	fa	f a
mnc-260_cross-1	mnc	260_cross	ʃakʰa	šaka	ʃ a kʰ a
mnc-398_medicine-2	mnc	398_medicine	ɔkʰtʰɔ	okto	ɔ kʰ tʰ ɔ
mnc-491_firmsolid-3	mnc	491_firmsolid	akʰtuŋka	akdungga	a kʰ t u ŋ k a
mnc-529_green-1	mnc	529_green	ɲɔwaŋkijan	niowanggiyan	ɲ ɔ w a ŋ k i j a n
mnc-544_stupid-2	mnc	544_stupid	tusixijɤn	dusihiyen	t u s i x i j ɤ n
mnc-412_death-1	mnc	412_death	altasi	aldasi	a l t a s i
mnc-829_light-1	mnc	829_light	fɔsɔmpi	fosombi	f ɔ s ɔ m p i
mnc-604_always-2	mnc	604_always	aikʰa ɔxɔtɤ	aika ohode	a i kʰ a + ɔ x ɔ t ɤ
mnc-767_creep-1	mnc	767_creep	pisurɤmpi	bisurembi	p i s u r ɤ m p i
mnc-446_fault-1	mnc	446_fault	fijɤrɤn	fiyeren	f i j ɤ r ɤ n
mnc-984_chat-1	mnc	984_chat	tʰatʰampi	tatambi	tʰ a tʰ a m p i
mnc-237_call-1	mnc	237_call	tɤrɤ	dere	t ɤ r ɤ
mnc-663_eleven-1	mnc	663_eleven	d͡ʒuwan ɤmu	juwan emu	dʒ u w a n + ɤ m u
mnc-728_blow-1	mnc	728_blow	tampi	dambi	t a m p i
mnc-557_living-1	mnc	557_living	wɤixun	weihun	w ɤ i x u n
mnc-671_eighty-1	mnc	671_eighty	d͡ʒakʰʊnd͡ʒu	jakūnju	dʒ a kʰ ʊ n dʒ u
mnc-737_eat-2	mnc	737_eat	puta d͡ʒɤmpi	buda jembi	p u t a + dʒ ɤ m p i
mnc-509_dry-1	mnc	509_dry	ɔlxɔn	olhon	ɔ l x ɔ n
mnc-63_water-1	mnc	63_water	mukʰɤ	muke	m u kʰ ɤ
mnc-419_master-1	mnc	419_master	pɔikɔd͡ʒi	boigoji	p ɔ i k ɔ dʒ i
mnc-824_lay-1	mnc	824_lay	sintampi	sindambi	s i n t a m p i
mnc-549_skilful-3	mnc	549_skilful	nɤrki	nergi	n ɤ r k i
mnc-996_recognize-1	mnc	996_recognize	tʰakʰampi	takambi	tʰ a kʰ a m p i
mnc-409_character-1	mnc	409_character	xɤrkɤn	hergen	x ɤ r k ɤ n
mnc-560_correct-1	mnc	560_correct	uru	uru	u r u
mnc-896_destroy-1	mnc	896_destroy	ɤfulɤmpi	efulembi	ɤ f u l ɤ m p i
mnc-193_man-3	mnc	193_man	nijalma	niyalma	n i j a l m a
mnc-448_end-1	mnc	448_end	ʃala	šala	ʃ a l a
mnc-935_kick-2	mnc	935_kick	fɤsxɤlɤmpi	feshelembi	f ɤ s x ɤ l ɤ m p i
mnc-701_thaw-2	mnc	701_thaw	mukʰɤnɤmpi	mukenembi	m u kʰ ɤ n ɤ m p i
mnc-123_feather-1	mnc	123_feather	fuŋaxa	fungaha	f u ŋ a x a
mnc-672_ninety-1	mnc	672_ninety	ujund͡ʒu	uyunju	u j u n dʒ u
mnc-700_freeze-3	mnc	700_freeze	kɤt͡ʃɤmpi	gecembi	k ɤ tʃ ɤ m p i
mnc-25_shoulder-1	mnc	25_shoulder	aitakan	aidagan	a i t a k a n
mnc-244_nation-1	mnc	244_nation	irkɤn	irgen	i r k ɤ n
mnc-868_shake-1	mnc	868_shake	fisiximpi	fisihimbi	f i s i x i m p i
mnc-125_wing-1	mnc	125_wing	asxa	asha	a s x a
mnc-944_kill-2	mnc	944_kill	sɤtɤmpi	sedembi	s ɤ t ɤ m p i
mnc-895_tear-2	mnc	895_tear	xʊwad͡ʒampi	hūwajambi	x ʊ w a dʒ a m p i
mnc-761_hurry-2	mnc	761_hurry	ɤkʰʃɤmpi	ekšembi	ɤ kʰ ʃ ɤ m p i
mnc-726_bark-1	mnc	726_bark	kʊwampi	gūwambi	k ʊ w a m p i
mnc-546_diligent-1	mnc	546_diligent	ɤd͡ʒɤkʰɤ	ejeke	ɤ dʒ ɤ kʰ ɤ
mnc-840_dig-2	mnc	840_dig	fɤtʰɤrɤmpi	feterembi	f ɤ tʰ ɤ r ɤ m p i
mnc-802_watch-1	mnc	802_watch	jasalampi	yasalambi	j a s a l a m p i
mnc-1010_own-1	mnc	1010_own	d͡ʒafampi	jafambi	dʒ a f a m p i
mnc-776_stop-1	mnc	776_stop	ilimpi	ilimbi	i l i m p i
mnc-228_message-1	mnc	228_message	mɤtɤ	mede	m ɤ t ɤ
mnc-198_family-1	mnc	198_family	xala	hala	x a l a
mnc-184_filth-2	mnc	184_filth	fɔŋsɔn	fongson	f ɔ ŋ s ɔ n
mnc-173_mushroom-1	mnc	173_mushroom	mɤku	megu	m ɤ k u
mnc-302_supportrest-1	mnc	302_supportrest	maʃan	mašan	m a ʃ a n
mnc-733_live-1	mnc	733_live	tʰɤmpi	tembi	tʰ ɤ m p i
mnc-692_flow-1	mnc	692_flow	ɤjɤmpi	eyembi	ɤ j ɤ m p i
mnc-256_piece-2	mnc	256_piece	farsi	farsi	f a r s i
mnc-943_cheat-2	mnc	943_cheat	patʰkʰalampi	batkalambi	p a tʰ kʰ a l a m p i
mnc-488_thick-3	mnc	488_thick	d͡ʒiramin	jiramin	dʒ i r a m i n
mnc-538_strong-1	mnc	538_strong	ɤlxɤŋkɤ	elhengge	ɤ l x ɤ ŋ k ɤ
mnc-714_increase-1	mnc	714_increase	nɤmɤmpi	nemembi	n ɤ m ɤ m p i
mnc-594_then-1	mnc	594_then	tʰɤrɤt͡ʃi	tereci	tʰ ɤ r ɤ tʃ i
mnc-904_kiss-2	mnc	904_kiss	aŋka ɔd͡ʒɔmpi	angga ojombi	a ŋ k a + ɔ dʒ ɔ m p i
mnc-168_gnat-1	mnc	168_gnat	ɔjɔ	oyo	ɔ j ɔ
mnc-544_stupid-1	mnc	544_stupid	ɤxɤlijan	eheliyan	ɤ x ɤ l i j a n
mnc-273_edge-1	mnc	273_edge	xɔʃɔ	hošo	x ɔ ʃ ɔ
mnc-26_arm-2	mnc	26_arm	majan	mayan	m a j a n
mnc-67_dust-2	mnc	67_dust	furanaxa	furanaha	f u r a n a x a
mnc-285_heap-1	mnc	285_heap	pɔrxɔn	borhon	p ɔ r x ɔ n
mnc-64_stone-2	mnc	64_stone	wɤxɤŋkɤ	wehengge	w ɤ x ɤ ŋ k ɤ
mnc-951_catch-1	mnc	951_catch	ɔmimpi	omimbi	ɔ m i m p i
mnc-482_little-1	mnc	482_little	ad͡ʒikɤ	ajige	a dʒ i k ɤ
mnc-934_beat-3	mnc	934_beat	tɤptɤrɤmpi	debderembi	t ɤ p t ɤ r ɤ m p i
mnc-451_morning-1	mnc	451_morning	t͡ʃimaxa	cimaha	tʃ i m a x a
mnc-319_gate-2	mnc	319_gate	aŋka	angga	a ŋ k a
mnc-845_turnturnaround-3	mnc	845_turnturnaround	kʰurpulampi	kurbulambi	kʰ u r p u l a m p i
mnc-214_happiness-2	mnc	214_happiness	kʰɤkʰsɤn	keksen	kʰ ɤ kʰ s ɤ n
mnc-535_blind-1	mnc	535_blind	tɔkɔ	dogo	t ɔ k ɔ
mnc-915_let-2	mnc	915_let	fakʰt͡ʃampi	fakcambi	f a kʰ tʃ a m p i
mnc-891_hinder-1	mnc	891_hinder	kʰampi	kambi	kʰ a m p i
mnc-451_morning-2	mnc	451_morning	t͡ʃimari	cimari	tʃ i m a r i
mnc-617_above-1	mnc	617_above	tɤrki	dergi	t ɤ r k i
mnc-892_spoil-1	mnc	892_spoil	kʊwaʃampi	gūwašambi	k ʊ w a ʃ a m p i
mnc-240_tone-1	mnc	240_tone	mutan	mudan	m u t a n
mnc-622_hardly-2	mnc	622_hardly	ɤtʰnɤkki	etneggi	ɤ tʰ n ɤ k k i
mnc-985_ask-3	mnc	985_ask	fɔnd͡ʒintumpi	fonjindumbi	f ɔ n dʒ i n t u m p i
mnc-499_blunt-1	mnc	499_blunt	mɔt͡ʃɔ	moco	m ɔ tʃ ɔ
mnc-761_hurry-3	mnc	761_hurry	ɔjɔmpumpi	oyombumbi	ɔ j ɔ m p u m p i
mnc-122_horn-2	mnc	122_horn	pulɤri	buleri	p u l ɤ r i
mnc-922_sing-1	mnc	922_sing	ut͡ʃulɤmpi	uculembi	u tʃ u l ɤ m p i
mnc-177_hay-1	mnc	177_hay	xifɤ	hife	x i f ɤ
mnc-713_decrease-1	mnc	713_decrease	sumpi	sumbi	s u m p i
mnc-256_piece-1	mnc	256_piece	tʰupi	tubi	tʰ u p i
mnc-603_often-1	mnc	603_often	d͡ʒiŋ	jing	dʒ i ŋ
mnc-415_sin-1	mnc	415_sin	ɤxɤ sui	ehe sui	ɤ x ɤ + s u i
mnc-306_pipe-2	mnc	306_pipe	tʰɤifun	teifun	tʰ ɤ i f u n
mnc-362_tea-1	mnc	362_tea	t͡ʃai	cai	tʃ a i
mnc-682_happen-1	mnc	682_happen	tʰuʃampi	tušambi	tʰ u ʃ a m p i
mnc-200_grandmother-1	mnc	200_grandmother	mama	mama	m a m a
mnc-337_pouch-1	mnc	337_pouch	fulakʰt͡ʃan	fulakcan	f u l a kʰ tʃ a n
mnc-602_sometimes-2	mnc	602_sometimes	ɤmɤnt fɔntɤ	emend fonde	ɤ m ɤ n t + f ɔ n t ɤ
mnc-590_now-1	mnc	590_now	nɤ	ne	n ɤ
mnc-1002_forget-1	mnc	1002_forget	mɤlɤmpi	melembi	m ɤ l ɤ m p i
mnc-796_beafraid-1	mnc	796_beafraid	tʰukʰsimpi	tuksimbi	tʰ u kʰ s i m p i
mnc-931_shoot-1	mnc	931_shoot	tʰuwa	tuwa	tʰ u w a
mnc-442_mistake-1	mnc	442_mistake	ufarat͡ʃun	ufaracun	u f a r a tʃ u n
mnc-966_sew-1	mnc	966_sew	ifimpi	ifimbi	i f i m p i
mnc-565_former-2	mnc	565_former	nɤnɤxɤ	nenehe	n ɤ n ɤ x ɤ
mnc-548_clever-1	mnc	548_clever	sɤkʰtʰu	sektu	s ɤ kʰ tʰ u
mnc-794_grumble-1	mnc	794_grumble	d͡ʒɔŋ d͡ʒɔŋ sɤmɤ kaʃampi	jong jong seme gašambi	dʒ ɔ ŋ + dʒ ɔ ŋ + s ɤ m ɤ + k a ʃ a m p i
mnc-588_instantly-1	mnc	588_instantly	utʰxai	uthai	u tʰ x a i
mnc-268_side-1	mnc	268_side	ɤrki	ergi	ɤ r k i
mnc-459_summer-1	mnc	459_summer	d͡ʒuwari	juwari	dʒ u w a r i
mnc-687_set-1	mnc	687_set	tʰulɤmpi	tulembi	tʰ u l ɤ m p i
mnc-343_sack-1	mnc	343_sack	fulxʊ	fulhū	f u l x ʊ
mnc-496_round-1	mnc	496_round	muxɤlijɤn	muheliyen	m u x ɤ l i j ɤ n
mnc-900_give-1	mnc	900_give	fimɤmpi	fimembi	f i m ɤ m p i
mnc-86_drop-1	mnc	86_drop	saptan	sabdan	s a p t a n
mnc-831_leave-1	mnc	831_leave	ald͡ʒampi	aljambi	a l dʒ a m p i
mnc-700_freeze-1	mnc	700_freeze	pɤikuwɤrɤmpi	beiguwerembi	p ɤ i k u w ɤ r ɤ m p i
mnc-126_claw-2	mnc	126_claw	wasixa	wasiha	w a s i x a
mnc-437_violence-2	mnc	437_violence	ɤrkɤlɤn	ergelen	ɤ r k ɤ l ɤ n
mnc-103_shore-1	mnc	103_shore	talin	dalin	t a l i n
mnc-399_bridge-1	mnc	399_bridge	kʰijɔɔ	kiyoo	kʰ i j ɔ ɔ
mnc-949_hunt-1	mnc	949_hunt	tʰumpi	tumbi	tʰ u m p i
mnc-407_letter-1	mnc	407_letter	d͡ʒasikan	jasigan	dʒ a s i k a n
mnc-881_divide-2	mnc	881_divide	tɤntɤmpi	dendembi	t ɤ n t ɤ m p i
mnc-49_breath-3	mnc	49_breath	sukʰtun	sukdun	s u kʰ t u n
mnc-637_this-1	mnc	637_this	upa	uba	u p a
mnc-702_melt-2	mnc	702_melt	sɤmɤmpi	semembi	s ɤ m ɤ m p i
mnc-838_improve-2	mnc	838_improve	tasampi	dasambi	t a s a m p i
mnc-510_full-1	mnc	510_full	d͡ʒalu	jalu	dʒ a l u
mnc-61_wind-1	mnc	61_wind	ɤtun	edun	ɤ t u n
mnc-965_knit-1	mnc	965_knit	tʰɔpt͡ʃilampi	tobcilambi	tʰ ɔ p tʃ i l a m p i
mnc-14_chin-1	mnc	14_chin	sɤnt͡ʃɤxɤ	sencehe	s ɤ n tʃ ɤ x ɤ
mnc-122_horn-1	mnc	122_horn	lapa	laba	l a p a
mnc-895_tear-1	mnc	895_tear	fakʰt͡ʃampi	fakcambi	f a kʰ tʃ a m p i
mnc-252_companion-1	mnc	252_companion	xɔkʰi	hoki	x ɔ kʰ i
mnc-620_not-1	mnc	620_not	wakʰa	waka	w a kʰ a
mnc-65_ground-2	mnc	65_ground	falan	falan	f a l a n
mnc-369_knot-1	mnc	369_knot	mampʰin	mampin	m a m pʰ i n
mnc-842_bend-2	mnc	842_bend	kɔxɔrɔmpi	gohorombi	k ɔ x ɔ r ɔ m p i
mnc-831_leave-2	mnc	831_leave	multʰud͡ʒɤmpi	multujembi	m u l tʰ u dʒ ɤ m p i
mnc-438_fight-1	mnc	438_fight	afan	afan	a f a n
mnc-639_everything-1	mnc	639_everything	ɤlɤŋkɤ	elengge	ɤ l ɤ ŋ k ɤ
mnc-883_bring-1	mnc	883_bring	kad͡ʒimpi	gajimbi	k a dʒ i m p i
mnc-313_cradle-1	mnc	313_cradle	turi	duri	t u r i
mnc-525_white-1	mnc	525_white	ʃaŋkijan	šanggiyan	ʃ a ŋ k i j a n
mnc-364_wool-1	mnc	364_wool	d͡ʒafu	jafu	dʒ a f u
mnc-739_gettired-1	mnc	739_gettired	pantampi	bandambi	p a n t a m p i
mnc-71_light-1	mnc	71_light	fijan	fiyan	f i j a n
mnc-166_ant-1	mnc	166_ant	jɤruxuwɤ	yeruhuwe	j ɤ r u x u w ɤ
mnc-771_drive-1	mnc	771_drive	talimpi	dalimbi	t a l i m p i
mnc-970_wipe-2	mnc	970_wipe	mapulanpi	mabulanbi	m a p u l a n p i
mnc-50_hunger-1	mnc	50_hunger	ɔmixɔn	omihon	ɔ m i x ɔ n
mnc-118_birch-1	mnc	118_birch	fija	fiya	f i j a
mnc-820_open-2	mnc	820_open	nɤrkʰimpi	nerkimbi	n ɤ r kʰ i m p i
mnc-859_break-1	mnc	859_break	pid͡ʒampi	bijambi	p i dʒ a m p i
mnc-853_lick-1	mnc	853_lick	ilɤmpi	ilembi	i l ɤ m p i
mnc-44_bone-1	mnc	44_bone	xaixan	haihan	x a i x a n
mnc-799_escape-1	mnc	799_escape	ɔŋkʰimpi	ongkimbi	ɔ ŋ kʰ i m p i
mnc-536_deaf-1	mnc	536_deaf	tutʰu	dutu	t u tʰ u
mnc-501_beautiful-1	mnc	501_beautiful	ɔixɔri	oihori	ɔ i x ɔ r i
mnc-676_or-1	mnc	676_or	ɤit͡ʃi	eici	ɤ i tʃ i
mnc-956_milk-2	mnc	956_milk	sirimpi	sirimbi	s i r i m p i
mnc-760_rush-1	mnc	760_rush	amt͡ʃampi	amcambi	a m tʃ a m p i
mnc-1001_remember-1	mnc	1001_remember	ɤd͡ʒɤmpi	ejembi	ɤ dʒ ɤ m p i
mnc-619_everywhere-2	mnc	619_everywhere	papatɤ	babade	p a p a t ɤ
mnc-87_foam-1	mnc	87_foam	ɔpɔŋki	obonggi	ɔ p ɔ ŋ k i
mnc-194_woman-2	mnc	194_woman	sarkan	sargan	s a r k a n
mnc-659_seven-1	mnc	659_seven	natan	nadan	n a t a n
mnc-404_road-1	mnc	404_road	d͡ʒukʊn	jugūn	dʒ u k ʊ n
mnc-115_limb-1	mnc	115_limb	karkan	gargan	k a r k a n
mnc-797_beafraidof-1	mnc	797_beafraidof	kɤlɤmpi	gelembi	k ɤ l ɤ m p i
mnc-591_today-1	mnc	591_today	ɤnɤŋki	enenggi	ɤ n ɤ ŋ k i
mnc-952_herd-1	mnc	952_herd	atulampi	adulambi	a t u l a m p i
mnc-613_backward-1	mnc	613_backward	t͡ʃasxʊn	cashūn	tʃ a s x ʊ n
mnc-775_depart-2	mnc	775_depart	ald͡ʒampi	aljambi	a l dʒ a m p i
mnc-258_half-1	mnc	258_half	xɔntʰɔxɔ	hontoho	x ɔ n tʰ ɔ x ɔ
mnc-551_merry-1	mnc	551_merry	urkuntʰu	urguntu	u r k u n tʰ u
mnc-357_oil-1	mnc	357_oil	iɔ	io	i ɔ
mnc-804_listen-1	mnc	804_listen	tɔnd͡ʒimpi	donjimbi	t ɔ n dʒ i m p i
mnc-127_paw-1	mnc	127_paw	fatʰxa	fatha	f a tʰ x a
mnc-947_gather-3	mnc	947_gather	ikʰtʰampi	iktambi	i kʰ tʰ a m p i
mnc-184_filth-1	mnc	184_filth	tasixi	dasihi	t a s i x i
mnc-992_translate-1	mnc	992_translate	xafumpi	hafumbi	x a f u m p i
mnc-277_hole-2	mnc	277_hole	aŋka	angga	a ŋ k a
mnc-226_fairytale-2	mnc	226_fairytale	d͡ʒupɤn	juben	dʒ u p ɤ n
mnc-381_ribbon-2	mnc	381_ribbon	supɤxɤ	subehe	s u p ɤ x ɤ
mnc-849_hold-1	mnc	849_hold	tʰatʰampi	tatambi	tʰ a tʰ a m p i
mnc-552_gentle-1	mnc	552_gentle	nɤsukʰɤn	nesuken	n ɤ s u kʰ ɤ n
mnc-615_below-1	mnc	615_below	nuŋkari	nunggari	n u ŋ k a r i
mnc-612_forward-1	mnc	612_forward	d͡ʒulɤsi	julesi	dʒ u l ɤ s i
mnc-328_knife-1	mnc	328_knife	xuwɤsi	huwesi	x u w ɤ s i
mnc-54_sleep-1	mnc	54_sleep	amu	amu	a m u
mnc-638_that-1	mnc	638_that	tʰɤrɤ	tere	tʰ ɤ r ɤ
mnc-29_palm-1	mnc	29_palm	simxun xɤfɤli	simhun hefeli	s i m x u n + x ɤ f ɤ l i
mnc-808_seem-2	mnc	808_seem	tʰujɤmpumpi	tuyembumbi	tʰ u j ɤ m p u m p i
mnc-93_forest-1	mnc	93_forest	pud͡ʒan	bujan	p u dʒ a n
mnc-60_air-2	mnc	60_air	apkʰai sukʰtun	abkai sukdun	a p kʰ a i + s u kʰ t u n
mnc-939_disturb-1	mnc	939_disturb	nuŋnɤmpi	nungnembi	n u ŋ n ɤ m p i
mnc-390_towel-1	mnc	390_towel	fuŋkʰu	fungku	f u ŋ kʰ u
mnc-48_liver-1	mnc	48_liver	faxʊn	fahūn	f a x ʊ n
mnc-224_truth-1	mnc	224_truth	jaarkijan	yaargiyan	j a a r k i j a n
mnc-495_soft-4	mnc	495_soft	xaixʊŋka	haihūngga	x a i x ʊ ŋ k a
mnc-708_sink-2	mnc	708_sink	tʰuxɤmpi	tuhembi	tʰ u x ɤ m p i
mnc-632_under-2	mnc	632_under	warki	wargi	w a r k i
mnc-561_nastydire-3	mnc	561_nastydire	ɔjɔkʰi	oyoki	ɔ j ɔ kʰ i
mnc-669_sixty-1	mnc	669_sixty	nind͡ʒu	ninju	n i n dʒ u
mnc-363_leather-1	mnc	363_leather	sukʰʊ	sukū	s u kʰ ʊ
mnc-1005_calculate-1	mnc	1005_calculate	tɤmpi	dembi	t ɤ m p i
mnc-13_beard-1	mnc	13_beard	xʊsɤ	hūse	x ʊ s ɤ
mnc-757_walk-1	mnc	757_walk	fɤkʰsimpi	feksimbi	f ɤ kʰ s i m p i
mnc-884_add-2	mnc	884_add	nɔŋkimpi	nonggimbi	n ɔ ŋ k i m p i
mnc-235_word-1	mnc	235_word	kisun	gisun	k i s u n
mnc-347_meal-2	mnc	347_meal	fuŋsɤ	fungse	f u ŋ s ɤ
mnc-293_walk-1	mnc	293_walk	fɤlijɤn	feliyen	f ɤ l i j ɤ n
mnc-893_damage-1	mnc	893_damage	taʃurampi	dašurambi	t a ʃ u r a m p i
mnc-288_oar-1	mnc	288_oar	d͡ʒɔɔlikʰʊ	joolikū	dʒ ɔ ɔ l i kʰ ʊ
mnc-339_bag-1	mnc	339_bag	tɔpɔtʰɔn	doboton	t ɔ p ɔ tʰ ɔ n
mnc-138_pig-1	mnc	138_pig	ulkijan	ulgiyan	u l k i j a n
mnc-773_go-1	mnc	773_go	japumpi	yabumbi	j a p u m p i
mnc-55_dream-1	mnc	55_dream	tʰɔlkin	tolgin	tʰ ɔ l k i n
mnc-223_reason-2	mnc	223_reason	tʰurkun	turgun	tʰ u r k u n
mnc-292_load-1	mnc	292_load	at͡ʃin	acin	a tʃ i n
mnc-898_give-1	mnc	898_give	pumpi	bumbi	p u m p i
mnc-780_arrive-3	mnc	780_arrive	isind͡ʒimpi	isinjimbi	i s i n dʒ i m p i
mnc-296_south-1	mnc	296_south	d͡ʒulɤrki	julergi	dʒ u l ɤ r k i
mnc-569_rich-1	mnc	569_rich	pajan	bayan	p a j a n
mnc-52_flavour-1	mnc	52_flavour	amtʰan simtʰɤn	amtan simten	a m tʰ a n + s i m tʰ ɤ n
mnc-245_work-2	mnc	245_work	xʊta	hūda	x ʊ t a
mnc-506_fresh-1	mnc	506_fresh	it͡ʃɤ	ice	i tʃ ɤ
mnc-787_try-3	mnc	787_try	aŋkasimpi	anggasimbi	a ŋ k a s i m p i
mnc-933_annoy-1	mnc	933_annoy	nuŋnɤmpi	nungnembi	n u ŋ n ɤ m p i
mnc-111_root-1	mnc	111_root	ta	da	t a
mnc-569_rich-2	mnc	569_rich	patarakʰa	badaraka	p a t a r a kʰ a
mnc-785_lookfor-2	mnc	785_lookfor	suwɤlɤmpi	suwelembi	s u w ɤ l ɤ m p i
mnc-906_cover-2	mnc	906_cover	puxɤlijɤmpi	buheliyembi	p u x ɤ l i j ɤ m p i
mnc-51_tear-1	mnc	51_tear	xʊwad͡ʒampi	hūwajambi	x ʊ w a dʒ a m p i
mnc-723_roar-2	mnc	723_roar	kʊjampi	gūyambi	k ʊ j a m p i
mnc-857_tie-1	mnc	857_tie	xutʰxumpi	huthumbi	x u tʰ x u m p i
mnc-377_cap-2	mnc	377_cap	fulxutʰu	fulhutu	f u l x u tʰ u
mnc-697_burn-3	mnc	697_burn	xalampi	halambi	x a l a m p i
mnc-890_preserve-1	mnc	890_preserve	tʰakʰsimpi	taksimbi	tʰ a kʰ s i m p i
mnc-47_stomach-1	mnc	47_stomach	kuwɤd͡ʒixɤ	guwejihe	k u w ɤ dʒ i x ɤ
mnc-596_once-2	mnc	596_once	ɤmu mari	emu mari	ɤ m u + m a r i
mnc-823_place-2	mnc	823_place	sintampi	sindambi	s i n t a m p i
mnc-156_crane-1	mnc	156_crane	pulɤxɤn	bulehen	p u l ɤ x ɤ n
mnc-863_rub-2	mnc	863_rub	mɔnd͡ʒimpi	monjimbi	m ɔ n dʒ i m p i
mnc-845_turnturnaround-1	mnc	845_turnturnaround	fɔrɔmpi	forombi	f ɔ r ɔ m p i
mnc-367_thread-1	mnc	367_thread	sirɤn	siren	s i r ɤ n
mnc-5_tooth-1	mnc	5_tooth	wɤixɤ	weihe	w ɤ i x ɤ
mnc-330_net-1	mnc	330_net	xɤlmɤxɤn i aʃu	helmehen i ašu	x ɤ l m ɤ x ɤ n + i + a ʃ u
mnc-684_end-1	mnc	684_end	tupɤmpi	dubembi	t u p ɤ m p i
mnc-124_fur-1	mnc	124_fur	furtɤxɤ	furdehe	f u r t ɤ x ɤ
mnc-154_duck-1	mnc	154_duck	nijɤxɤ	niyehe	n i j ɤ x ɤ
mnc-318_door-1	mnc	318_door	ut͡ʃɤ	uce	u tʃ ɤ
mnc-23_bosom-2	mnc	23_bosom	xɤfɤlijɤn	hefeliyen	x ɤ f ɤ l i j ɤ n
mnc-855_tearoff-1	mnc	855_tearoff	tʰatumpi	tadumbi	tʰ a t u m p i
mnc-909_guide-3	mnc	909_guide	jarxʊtampi	yarhūdambi	j a r x ʊ t a m p i
mnc-137_sheep-1	mnc	137_sheep	xɔnin	honin	x ɔ n i n
mnc-821_close-1	mnc	821_close	kitampi	gidambi	k i t a m p i
mnc-263_gap-3	mnc	263_gap	funtʰuxu	funtuhu	f u n tʰ u x u
mnc-703_dry-2	mnc	703_dry	akʰijapumpi	akiyabumbi	a kʰ i j a p u m p i
mnc-408_book-1	mnc	408_book	pitʰxɤ	bithe	p i tʰ x ɤ
mnc-128_tail-1	mnc	128_tail	unt͡ʃɤxɤn	uncehen	u n tʃ ɤ x ɤ n
mnc-893_damage-2	mnc	893_damage	kʰɔkʰirampi	kokirambi	kʰ ɔ kʰ i r a m p i
mnc-561_nastydire-1	mnc	561_nastydire	t͡ʃaxi	cahi	tʃ a x i
mnc-918_visit-2	mnc	918_visit	ɤltɤmpumɤ ɤŋkɤlɤnɤmpi	eldembume enggelenembi	ɤ l t ɤ m p u m ɤ + ɤ ŋ k ɤ l ɤ n ɤ m p i
mnc-183_ash-1	mnc	183_ash	furanaxa	furanaha	f u r a n a x a
mnc-589_later-2	mnc	589_later	amaka inɤŋki	amaga inenggi	a m a k a + i n ɤ ŋ k i
mnc-1012_sell-1	mnc	1012_sell	unt͡ʃampi	uncambi	u n tʃ a m p i
mnc-846_raise-2	mnc	846_raise	wɤsimpumpi	wesimbumbi	w ɤ s i m p u m p i
mnc-816_finish-2	mnc	816_finish	wat͡ʃixijampi	wacihiyambi	w a tʃ i x i j a m p i
mnc-994_believe-1	mnc	994_believe	akʰtampi	akdambi	a kʰ t a m p i
mnc-520_bitter-1	mnc	520_bitter	kɔsixɔn	gosihon	k ɔ s i x ɔ n
mnc-609_there-2	mnc	609_there	tʰupatɤ	tubade	tʰ u p a t ɤ
mnc-842_bend-3	mnc	842_bend	pukʰtalampi	bukdalambi	p u kʰ t a l a m p i
mnc-951_catch-2	mnc	951_catch	kamampi	gamambi	k a m a m p i
mnc-388_pillow-1	mnc	388_pillow	t͡ʃirkʰʊ	cirkū	tʃ i r kʰ ʊ
mnc-874_drag-1	mnc	874_drag	uʃampi	ušambi	u ʃ a m p i
mnc-873_carry-1	mnc	873_carry	tʰukʰijɤmpi	tukiyembi	tʰ u kʰ i j ɤ m p i
mnc-549_skilful-1	mnc	549_skilful	fakʰsi	faksi	f a kʰ s i
mnc-368_button-1	mnc	368_button	tʰɔxɔn	tohon	tʰ ɔ x ɔ n
mnc-913_lead-1	mnc	913_lead	kamampi	gamambi	k a m a m p i
mnc-647_who-1	mnc	647_who	wɤ	we	w ɤ
mnc-820_open-1	mnc	820_open	nɤimpi	neimbi	n ɤ i m p i
mnc-589_later-1	mnc	589_later	amaka	amaga	a m a k a
mnc-428_wealth-1	mnc	428_wealth	ulin pajan	ulin bayan	u l i n + p a j a n
mnc-787_try-2	mnc	787_try	amtʰalampi	amtalambi	a m tʰ a l a m p i
mnc-861_hit-1	mnc	861_hit	kɔpimpi	gobimbi	k ɔ p i m p i
mnc-374_sleeve-1	mnc	374_sleeve	ulxi	ulhi	u l x i
mnc-18_nape-1	mnc	18_nape	mɤifɤn	meifen	m ɤ i f ɤ n
mnc-380_ring-1	mnc	380_ring	kuifun	guifun	k u i f u n
mnc-871_fill-1	mnc	871_fill	filxɤmpi	filhembi	f i l x ɤ m p i
mnc-548_clever-3	mnc	548_clever	kapsixijan	gabsihiyan	k a p s i x i j a n
mnc-300_board-1	mnc	300_board	sarxʊ	sarhū	s a r x ʊ
mnc-725_sound-1	mnc	725_sound	kuwɤmpi	guwembi	k u w ɤ m p i
mnc-841_bow-1	mnc	841_bow	musɤmpi	musembi	m u s ɤ m p i
mnc-74_fog-1	mnc	74_fog	tʰalman	talman	tʰ a l m a n
mnc-198_family-3	mnc	198_family	pɔikɔn aŋkala	boigon anggala	p ɔ i k ɔ n + a ŋ k a l a
mnc-9_face-1	mnc	9_face	t͡ʃira	cira	tʃ i r a
mnc-783_wait-1	mnc	783_wait	alijampi	aliyambi	a l i j a m p i
mnc-49_breath-2	mnc	49_breath	ɤrkɤn	ergen	ɤ r k ɤ n
mnc-69_spark-2	mnc	69_spark	jɔlɔŋki	yolonggi	j ɔ l ɔ ŋ k i
mnc-899_hand-3	mnc	899_hand	isind͡ʒimpi	isinjimbi	i s i n dʒ i m p i
mnc-730_shout-1	mnc	730_shout	surɤmpi	surembi	s u r ɤ m p i
mnc-307_house-2	mnc	307_house	ʊlɤn	ūlen	ʊ l ɤ n
mnc-255_sort-2	mnc	255_sort	sukʰtun	sukdun	s u kʰ t u n
mnc-807_feel-1	mnc	807_feel	puʃumpi	bušumbi	p u ʃ u m p i
mnc-356_butter-1	mnc	356_butter	sun nimɤŋki	sun nimenggi	s u n + n i m ɤ ŋ k i
mnc-133_flock-2	mnc	133_flock	fɤnixɤ	fenihe	f ɤ n i x ɤ
mnc-331_hook-1	mnc	331_hook	kɔxɔn	gohon	k ɔ x ɔ n
mnc-309_stove-1	mnc	309_stove	d͡ʒun	jun	dʒ u n
mnc-217_desire-2	mnc	217_desire	pujɤn	buyen	p u j ɤ n
mnc-366_needle-1	mnc	366_needle	ulmɤ	ulme	u l m ɤ
